ticker,as_of,filing_date,form,C,Ab,Dv,B,S,Dt,CCE,cce_raw,weight,o_sentence,p_sentence,section,cce_delta,prev_cce,prev_form,prev_filing_date,label,dCCE
BBBY,2023-01-05,2022-12-20,10-Q,0.395,0.5,0.9,1.0,0.6567146182060242,0.0,0.22806701324513085,0.17775000000000002,0.315,The Company MUST maintain a consolidated leverage ratio below 4.0x under its credit agreement.,Management MAY incur additional borrowings subject to lender consent unless the leverage ratio exceeds 4.25x.,LIQUIDITY AND CAPITAL RESOURCES,0.011027398724329202,0.21703961452080164,10-Q,2022-09-20,1,0.03622363958417957
MPW,2023-07-11,2023-05-15,10-Q,0.7699999999999999,0.5,1.0,1.0,0.618025578558445,0.0,0.20849507910010517,0.38499999999999995,0.4692,The borrower MUST maintain an interest coverage ratio above 3.0x across all secured loans.,The borrower MAY incur secured debt subject to lender approval unless a default exists.,CREDIT FACILITIES,-0.015636506965249264,0.22413158606535444,10-K,2023-02-20,1,-0.031115420093969608
UPST,2023-08-15,2023-07-20,10-Q,0.48,0.5,1.0,1.0,0.7184700965881348,0.0,0.26431917410610695,0.24,0.33705,The company MUST maintain a minimum unrestricted cash balance of $100 million.,The company MAY borrow additional funds subject to covenant compliance unless the fixed charge coverage ratio falls below 1.5x.,MANAGEMENT'S DISCUSSION AND ANALYSIS,0.12775984752036165,0.1365593265857453,10-Q,2023-05-10,1,0.14660048017062727
AAPL,2023-05-01,2023-02-28,10-Q,0.2,0.5,0.2,0.0,0.6940315365791321,0.0,0.21205840314319552,0.020000000000000004,1.2305000000000001,The company MUST maintain prudent liquidity consistent with its investment grade rating.,The company MAY issue notes for strategic investments in accordance with board-approved policies.,LIQUIDITY AND CAPITAL RESOURCES,0.21205840314319552,0.0,10-K,2022-11-01,0,0.2365878257007659
MSFT,2023-05-01,2023-04-20,10-Q,0.08,0.5,0.0,0.0,0.6930361986160278,0.0,0.0,0.0,1.1500000000000001,The company MUST maintain strong cash flow generation to fund strategic investments.,The company MAY issue notes within authorized limits.,LIQUIDITY AND CAPITAL RESOURCES,-0.039755574297103025,0.039755574297103025,10-K,2023-01-25,0,-0.07265390409684135
JNJ,2023-05-01,2023-04-10,10-Q,0.08,0.5,0.0,1.0,0.6224472522735596,0.0,0.17425039568316436,0.0,0.34500000000000003,The company MUST maintain financial flexibility to pursue R&D investments.,The company MAY borrow under its revolving credit agreement subject to customary approvals.,LIQUIDITY AND CAPITAL RESOURCES,0.04598779511777401,0.12826260056539035,10-K,2023-01-15,0,0.08336388953806925
